[
  {
    "id": 1,
    "title": "Lettura Pubblica Mensile",
    "date": "15 Maggio 2026",
    "time": "18:30",
    "location": "Centro Culturale",
    "description": "Ascolta gli autori del nostro gruppo leggere le loro opere inedite.",
    "status": "past"
  },
  {
    "id": 2,
    "title": "Workshop: Tecniche di Scrittura Creativa",
    "date": "22 Maggio 2026",
    "time": "19:00",
    "location": "Biblioteca Civica",
    "description": "Impara le tecniche fondamentali della scrittura creativa con esperti del settore.",
    "status": "past"
  },
  {
    "id": 3,
    "title": "Incontro con Autore Ospite",
    "date": "5 Giugno 2026",
    "time": "17:00",
    "location": "Sala Conferenze",
    "description": "Incontra un autore affermato e scopri il suo processo creativo.",
    "status": "upcoming"
  },

  {
    "id": 5,
    "title": "Club di Lettura: \"Classici del Novecento\"",
    "date": "12 Aprile 2026",
    "time": "17:00",
    "location": "Centro Culturale",
    "description": "Discussione e analisi di capolavori della letteratura italiana del Novecento.",
    "status": "past"
  }
]
